date,text
2023-12-20,UK and Switzerland agree to deepen ties between City and Swiss banking system Treasury says post-Brexit tie-up to be signed on Thursday will ease cross-border market access for financial services
2023-12-21,"Christmas rail travel chaos as Euston services cancelled and Eurostar hit by strike – as it happened A strike by Channel Tunnel workers has blocked train travel between France and Britain, while powerline problems hit West Coast mainline"
2023-12-21,‘A bellwether for the industry’: why Warner-Paramount talk is no surprise Investors seemed unimpressed but analysts say even talk of a merger reflects moves to consolidate in a tough market
2023-12-22,"Downbeat UK growth data adds to picture of an economy going nowhere Whether or not a recession materialises, the GDP figures are bad news for government"
2023-12-22,New pressure to cut interest rates as UK economy falters and US inflation dips Inflation fall to 3.2% fuels calls for Federal Reserve to cut rates sooner as UK GDP figures push economy towards recession
2023-12-22,"Rail fares in England to rise 4.9%; UK economy on brink of recession; US PCE inflation slows – as it happened UK GDP fell by 0.1% in July-September, worse than first estimated, raising fears of a recession"
2023-12-24,"What the UK wants for Christmas is to get Brexit undone  Importers, exporters, private citizens and the Labour party all urgently need the economy to function better than this"
2023-12-26,"The stock market story of 2023? The growing domination of US tech The big seven firms are weighted as much on global indices as all Japanese, British, French, Canadian and Chinese companies"
2023-12-27,"New York Times accuses ChatGPT maker OpenAI and Microsoft of copyright infringement – as it happened Rolling coverage of the latest economic and financial news, as news publisher says AI tools use its content without permission"
2023-12-27," Swedish ‘Spotify of heat pumps’ hopes to reach more UK homes Aira, which offers subscription service at no upfront cost, has sights set on UK’s growing heat pump market"
2023-12-27," Swedish ‘Spotify of heat pumps’ hopes to reach more UK homes Aira, which offers subscription service at no upfront cost, has sights set on UK’s growing heat pump market"
2023-12-28,"UK dealmaking shrinks in 2023, but economy predicted to ‘turn corner’ in 2024 – as it happened PwC predicts inflation will fall near ‘normal levels’ in 2024, but corporate insolvencies are forecast to jump"
2023-12-29,"UK house prices fall by 1.8% during year amid higher mortgage costs Property market weak, says Nationwide, which expects prices to remain flat or drop slightly in 2024"
2023-12-29,"FTSE 100 ends year up 3.8% but trails rival markets in Europe and US Lack of tech companies leaves UK floundering against Wall Street, where S&amp;P 500 has jumped 25%"
2023-12-31,"Smiles all round as financial markets end 2023 on an unexpected high Equities worldwide have had a good year, the pound looks healthy and gold is positively gleaming. Shame about the lacklustre state of most UK shares"
2024-01-02,Golden zone: could Australia’s economy pull off a miracle in 2024? Signs suggest inflation and interest rates may fall considerably without killing growth or employment. The government will be desperately hoping so
2024-01-02,"Six things to watch in 2024 global economy, from tax cuts to AI The Israel-Hamas war could broaden, and many developing countries are on a path to crisis"
2024-01-02,"Footsie turns 40: FTSE 100’s rise, rise and stagnation over four decades The index grabbed attention from the start, but shows its age as 21st-century tech stocks go elsewhere"
2024-01-02,"Fitter working for Sharps takes legal action over employment rights Firm says he is a self-employed subcontractor, but he says he is a worker and should get holidays and sick pay"
2024-01-02,Oil prices rise after Iran rejects calls to end support for Houthi Red Sea attacks Brent crude is up 2% to $78.77 a barrel as hopes of strong demand in China also push up prices
2024-01-03,Thames Water’s owners only have themselves to blame for the writedowns It looks as if USS simply overpaid and underestimated the effort and catch-up investment required
2024-01-04,"Global economy faces period of prolonged weakness, UN warns Secretary general urges countries to increase investment to avoid falling behind on climate action and sustainable development"
2024-01-04,Britain’s housing market may be ‘past peak pain’ but what will 2024 bring? Second year of falling prices expected though recovery is likely in the second half as interest rates come down
2024-01-05,"Global finances: what does 2024 hold in store for major economies and markets? From a potential roaring 20s in the markets to recession fears in the UK, here’s our look ahead to the year in finance"
2024-01-05,US economy adds more jobs than expected; eurozone inflation rises to 2.9% – as it happened US unemployment rate remains at 3.7% against expectations of an uptick; however jobs increases in November and October are revised lower
2024-01-05,"UK house prices rise again but Halifax forecasts up to 4% drop in 2024 Growth rates driven by shortage of properties on market, says mortgage lender, with typical home worth £287,105"
2024-01-07,"Forget talk of Labour’s ‘tax bombshell’. It’s Tory policy that needs a watchful eye Conservative economic promises such as tax cuts fail to match fiscal reality – the key to progress is investment, not austerity"
2024-01-07,"Brexit’s pint-sized ‘benefits’ are a measure of its failure Wine in imperial measures, we are told, is ‘what leaving was all about’, while the UK struggles outside the single market"
2024-01-09,"CDs shine as UK music sales in 2023 jump to near record figure Taylor Swift dominates album market, while best-performing track is Miley Cyrus’s Flowers"
2024-01-09,"Risk of financial ‘wasted decade’ for poor countries, World Bank warns Global economy set to slow for third year in 2024, with poor countries especially hard hit, body says"
2024-01-10,AI-driven misinformation ‘biggest short-term threat to global economy’ World Economic Forum highlights risk of election interference in year UK and US go to polls
2024-01-10,"Retail figures show we’re desperate for a bargain rather than flush with cash. The RBA should take note When retail spending surges, the Reserve Bank can be tempted to raise interest rates – but analysing the economy requires an understanding of what is happening in the real world."
2024-01-10,"Sainsbury’s won shoppers from rivals at Christmas but Argos sales dive Supermarket reports 8.6% rise in grocery sales, although consumers rein in spending on electrical goods"
2024-01-10,"Bank of England governor hopes mortgage rates will keep falling, as economists see inflation hitting 2% soon – as it happened Rolling coverage of the latest economic and financial news, as MPs quiz BoE officials about the impact of high interest rates"
2024-01-11,UK car finance: ‘millions of drivers could get payout’ as watchdog investigates FCA to examine whether consumers have been charged inflated loan rates on new and secondhand cars
2024-01-11,Tesco and Marks & Spencer emerge as Christmas winners Online growth and festive sales fuel lift in Tesco profit forecast as M&amp;S wins back fashion market share
2024-01-11,"M&S has Waitrose in its sights as it hails ‘best ever Christmas’ Retail group has opened larger stores, cut prices on basics and persuaded food shoppers to use it for more than just sandwiches"
2024-01-12,"BAE Systems in line for potential windfall from Kazakhstan airline flotation Air Astana, which is 49% owned by the British defence firm, announces plans to float on London stock market"
2024-01-12,"UK economy returns to growth amid Black Friday spending lift GDP rises by 0.3% in November after October decline, with car leasing and video games fuelling bounceback"
2024-01-12,UK interest rate cuts cannot come soon enough for economy and Jeremy Hunt Modest GDP growth in November gives chancellor little to celebrate when three-month figure shows contraction
2024-01-12,Oil prices hit $80 a barrel as fears grow over Red Sea disruption to trade Experts warn of economic impact of sustained shipping attacks and Middle East tensions
2024-01-12,"UK ‘still at risk of technical recession’ despite November growth; oil price hits $80 after Yemen airstrikes – as it happened UK growth rebounded in November, but economists warn that a second quarterly contraction is still a risk"
2024-01-12,DP World port dispute: how damaging is this to Australia’s economy and will it push up prices? Supply-chain delays can increase costs in a range of areas and experts say the impact could be significant
2024-01-12,"Citigroup to cut 20,000 jobs after steep quarterly loss JPMorgan Chase posts record annual profit as earnings season gets under way"
2024-01-13,EDF customers fear a cold winter after off-peak electricity rate almost doubles Economy 7 users have always paid much cheaper rate to recharge storage or water heaters overnight
2024-01-16,"Zelenskiy tells Davos chiefs: ‘Strengthen our economy, we will strengthen your security’ Standing ovation greets Ukrainian president’s speech amid strong support from EU and business leaders"
2024-01-17,"UK urges west to use frozen Russian assets to rebuild Ukraine’s economy Foreign secretary says there are legal, moral and political justifications for using assets of $350bn"
2024-01-17,"Neither a pandemic nor interest rate rises: can anything dent the Australian housing market?  The entire political focus over the past 40 years has been to keep house prices from falling, or even abating"
2024-01-17,"BP names interim boss Murray Auchincloss as permanent chief executive Former finance chief to replace Bernard Looney, who departed unexpectedly last year"
2024-01-18,"Sainsbury’s Bank open to offers as retailer plans to exit finance Company exploring options as it plans to shift focus back to food and retail, rather than services"
2024-01-18,"Tata Steel to shut down Port Talbot blast furnaces, putting 3,000 jobs at risk Firm rejects union plan, leaving UK on course to become only major economy unable to make steel from scratch"
2024-01-18,"Australia sheds 65,000 jobs in December but unemployment rate remains at 3.9% ABS figures show a steep drop in the participation rate from a revised record 67.3% in November to 66.8% in December"
2024-01-19,"Tata Steel accused of ‘industrial vandalism’ over plan to cut up to 2,800 UK jobs – as it happened Tata Steel confirmed plans to close two Welsh blast furnaces and cut up to 2,800 jobs"
2024-01-19,‘We’ve got to break them up’: farming groups say supermarkets use market power to distort prices Claim comes amid state and federal inquiries into Australian grocery sector and what producers say is a widening gap between wholesale and shelf prices
2024-01-19,Retail slump raises spectre of recession as Hunt looks more Truss-like by the day Surprise fall in December sales damages chancellor’s claims that UK economy is on right track
2024-01-19,‘It’s a betrayal’: Port Talbot anger over Tata Steel’s decision to close furnaces Local people fear their home will become a ‘ghost town’ and draw parallels with devastated Welsh coal communities
2024-01-19,"‘Devastating’: Port Talbot steelworks to shut blast furnaces and shed up to 2,800 jobs Tata confirms shutdown and unions threaten strikes at the plant amid fury in south Wales community"
2024-01-21,"Questions raised over British Steel’s finances Auditors sound warning about ability of firm of 4,500 staff to operate without new funds from Chinese owner Jingye"
2024-01-21,"Fellow Republicans, it’s time to admit that the US economy isn’t bad Multiple indicators – from GDP growth to the unemployment rate (and even inflation) – point to a robust US economic engine"
2024-01-21,"Big tech boom or bust? Experts see signs of strength after wave of layoffs Even as more job cuts await, some analysts see the beginnings of a bull market in the coming season of earnings reports"
2024-01-22,"‘Good chance’ UK may have fallen into technical recession; S&P 500 hits fresh all-time high – as it happened Rolling coverage of the latest economic and financial news, as US stocks hit record high in early trading"
2024-01-22,"ACCC should scrutinise Coles and Woolworths’ market power, former watchdog chair says Allan Fels says duopolies have a mutual incentive not to decrease prices, noting Australia’s major supermarkets have not had a price war in years"
2024-01-22,"Top hedge funds make record $67bn in profits for 2023 Profits boom at top 20 funds including TCI, Citadel, Viking and Pershing Square thanks to rebound in stock markets"
2024-01-22,"UK economic growth to rebound in late 2024, leading forecaster says EY Item Club report hands PM new year boost with prediction that inflation drop will allow interest rates to fall to 4% by year end"
2024-01-22,Wall Street notches fresh records as S&P 500 and Dow Jones close at all-time high Record highs come amid hopes a cooldown in inflation will allow Federal Reserve to cut interest rates several times this year
2024-01-22,"Tweaks, delays and compromises define UK’s post-Carillion response From initial hopes of radical reform, we’ve ended up with a slight adjustment to the corporate governance code"
2024-01-23,"Hundreds of millions of pounds extra investment needed in Tata steel, Welsh economy minister warns – as it happened Rolling coverage of the latest economic and financial news, as steel workers head to parliament to press MPs over job cuts at Port Talbot"
2024-01-23,Chapel Down toasts rising sales as English fizz grabs market share from champagne Price rises help lift profits as sales of its sparkling wine soar but still products slide
2024-01-23,"Easing law on marketing baby formula just helps big brands, campaigners say Iceland boss has written to MPs claiming that changing rules would help cut prices for families"
2024-01-23,ExxonMobil’s attempt to silence activist investors should be a warning to shareholders The US oil company is off to court to try to block a green activist motion aimed at accelerating the company’s attempts to cut emissions
2024-01-24,"Fund manager abrdn to pay bonuses despite slashing 500 jobs  The investment company is also outsourcing work, selling offices and renegotiating contracts while recognising ‘performing colleagues’"
2024-01-24,"UK factories cut production for 11th month in a row amid tensions in Red Sea Dominant services sector expanded more than expected, boosting overall outlook for British economy, according to survey"
2024-01-24,Eurostar passenger numbers back to pre-Covid levels Cross-Channel train service expects a busy 2024 and will run a limited London to Amsterdam service
2024-01-24,Questions over £22bn in UK billpayer cash handed to wood-burning firms Spending watchdog calls for biomass subsidy scheme to have tougher environmental requirements
2024-01-25,ECB chief says talk of interest rate cuts ‘premature;’ US economy grows faster than expected – as it happened European Central Bank president Christine Lagarde holds press conference after bank keeps interest rates unchanged as expected
2024-01-25,UK says Emirates-backed stake in Vodafone poses national security risk UAE firm’s increased investment prompts Cabinet Office order for security panel at telecoms company
2024-01-26,"Superdry loses fourth finance boss in five years as losses widen Giles David to replace Shaun Wills, with sales falling at troubled fashion brand"
2024-01-26,"UK ditches post-Brexit Canada trade talks; Vodafone and Three UK merger under investigation – as it happened Live, rolling coverage of business, economics and financial markets as Canada says UK was unwilling to give access to agricultural products"
2024-01-28,"After the latest Max crisis, Boeing must focus on flight, not finance For years, the company has focused on costs at the expense of its engineering heritage. Now the numbers look bad too"
2024-01-28,"Tata Steel ‘open to more UK investment’ despite Port Talbot job cuts <strong>Exclusive</strong>: Steelworks owner to float possibility of new, smaller plant as it prepares to defend redundancies in Wales to MPs"
2024-01-28,"Governments facing wipeout will always cut taxes but there are better uses for UK’s £20bn windfall Instead, Jeremy Hunt could shelve plan to cut public investment or repair welfare safety net"
2024-01-29,Millions of BT customers could get up to £400 as ‘overcharging’ lawsuit begins Legal action claims provider used market dominance to levy excessive prices for landlines
2024-01-29,Superdry considers store closures as part of cost-cutting plan Struggling fashion retailer looking at options including job cuts after reporting slide in sales
2024-01-30,Eurozone narrowly avoids recession as German economy shrinks Single currency zone’s stagnating GDP figure will add to pressure for ECB interest rate cut
2024-01-30,Labour vows to cut financial ‘red tape’ and ‘unashamedly champion’ UK sector Report shows Labour move to scrap many rules and processes as party denies plan will dilute consumer protections
2024-01-30,Green economy must be next UK government’s No 1 priority – Lane Fox Exclusive: British Chambers of Commerce head urges parties not to backtrack on eco pledges in run-up to general election
2024-01-30,"Saudi Arabia surprises oil markets by ditching plan to increase production Blow to Joe Biden, who had hoped to benefit from lower pump prices in an election year"
2024-01-30,"IMF warns Hunt against tax cuts; eurozone avoids recession – as it happened Rolling coverage of the latest economic and financial news, as the eurozone stagnates in the final quarter of 2023"
2024-01-30,"Foxtons boss Guy Gittins: ‘We absolutely don’t welcome 20% rent increases’ The chief executive who cut his teeth in the estate agency’s sharp-suited, hard-pushing heyday worries today’s letting market is ‘terrible for tenants’"
2024-01-30,UK shareholders should vote against Flutter’s flight to the US The dwindling band of UK loyalists should send a message that exiting to the US is not as easy as flicking a switch
2024-01-30,HSBC fined £57m over ‘serious’ deposit protection failings Regulator says bank failed to properly implement Financial Services Compensation Scheme
2024-01-31,Obesity drug boom pushes Novo Nordisk shares to record high Market value of Danish drugmaker behind Wegovy and Ozempic tops $500bn as demand soars
2024-01-31,"UK house prices rise in January, Novo Nordisk obesity drug sales surge – as it happened Nationwide says housing market looks ‘more positive’ as prices rise 0.7%; the Danish maker of Ozempic and Wegovy predicts further strong growth in 2024"
2024-02-01,"Labour rules out raising corporation tax above 25% in next parliament Shadow chancellor Rachel Reeves tells business summit of measures to boost investment, productivity and certainty"
2024-02-01,Bank of England sticks with 5.25% interest rate but hints at coming cut Inflation forecast to temporarily fall below 2% in May as policymakers’ vote on base rate splits three ways
2024-02-02,"Biden hails robust jobs market as proof US economy is ‘strongest in the world’ US adds 353,000 new jobs over month as growth in hiring gives boost to president, whose polling on economy has remained weak"
2024-02-02,"Joe Biden declares America’s economy ‘is the strongest in the world’ after jobs report smashes forecasts – as it happened Rolling coverage of the latest economic and financial news, as US adds 353,000 new jobs in January"
2024-02-02,Water firms in England and Wales urged to invest profits in cutting bills Suppliers expected to charge average 6% more from April despite public anger at underinvestment and sewage dumping
2024-02-04,Should the UK embrace higher net migration or rethink the economy? If the population is to grow on the scale predicted the UK will need the infrastructure to service a much-expanded citizenry
2024-02-04,Conflict of interest row greets new boss of watchdog for City regulators Campaigners criticise Rachel Kent’s decision to remain part-time partner at law firm advising finance clients and UK government
2024-02-05,It’s ‘national sickie day’ – is ill-health holding back the UK economy? ONS figures suggest long-term sickness is preventing more people from looking for work
2024-02-05,Novo Nordisk parent buys US drug firm for $16.5bn to expand Wegovy supply Company to acquire three sites from Catalent amid runaway demand for weight-loss drug
2024-02-06,"Bank of England’s Dhingra warns of ‘downside risks’ for UK economy; Adam Neumann ‘seeking to buy WeWork out of bankruptcy’ – as it happened Rolling coverage of the latest economic and financial news, as BoE dove pushes for early cuts to UK interest rates to support economy"
2024-02-06,Eight million UK households to get £299 cost of living payments from Tuesday Last of three instalments totalling up to £900 paid to people on means-tested benefits
2024-02-06,BP CEO calls for pragmatism on green aims as profits halve Murray Auchincloss says BP’s ‘aim’ to reduce oil and gas emissions by 20-30% was not confirmed as a ‘target’
2024-02-07,"New York Community Bancorp shares plummet amid unease over regional banking Alessandro DiNello, new executive chairman of regional US lender, acknowledges ‘serious situation’ as stock at lowest level in decades"
2024-02-07,"UK property prices have rebounded quickly but talk of a boom is premature  The scope for a near-term surge is limited by the market only having just avoided a crash, say analysts"
2024-02-07,UK’s biggest housebuilder Barratt to buy rival Redrow for £2.5bn Companies reach agreement over all-share offer to create combined group with turnover topping £7bn
2024-02-08,"CBI chief warns against ‘large scale tax cuts driven by short-termism’; BoE’s Mann warns of ‘pernicious’ inflation – as it happened Rolling coverage of the latest economic and financial news, as China slipped deeper into deflationary territory in January"
2024-02-08,CBI tells Jeremy Hunt to focus on green investment instead of tax cuts in budget Lobby group joins calls for chancellor to resist pre-election giveaways next month and spend on projects to boost economy
2024-02-08,"In the year of the dragon, will China breathe fire into its deflating economy? Plunge in consumer prices has sparked calls for a stimulus package – yet Beijing may still stick to the new normal of lower growth"
2024-02-08,China consumer prices plunge at fastest rate for 15 years as deflation fears deepen Plummeting food prices feed steep annual drop amid renewed calls to stimulate economy and offset weakening demand
2024-02-08,AGL Energy posts $576m half-year profit as it rejects accusations of price gouging consumers The company’s CEO says he’s ‘acutely aware of the cost of living pressures both our customers and the broader community is under’
2024-02-09,"S&P 500 closes above 5,000 for first time as US inflation cools Breaking 5,000 is unlikely to slow the index’s rise, experts say as reports highlight resilient US economy"
2024-02-10,The hard truth is that Britain’s entrepreneurs simply don’t innovate Billions in tax relief is showered on UK small businesses in the belief that they are transforming the economy. They aren’t
2024-02-11,"Recession verdict for UK economy will be no laughing matter for Hunt and Sunak Figures on GDP, wages and inflation this week are set to offer Labour plenty of scope for criticising Tories’ economic competence"
2024-02-11,"Are older, richer voters really against big spending? Maybe not as much as Labour fears Starmer desperately wants to win back the trust of a crucial, and famously cautious, demographic. But support for public investment is growing, writes economics editor Philip Inman"
2024-02-12,"The Body Shop set to appoint administrators; UK hit by ‘significant long-run cost of Brexit’ – as it happened Goldman Sachs ‘Doppelgänger’ analysis suggests UK real GDP has unperformed by 5% since 2016 vote, while Body Shop’s owners have filed the intention to appoint administrators."
2024-02-12,"US oil companies to merge in $26bn deal as firms rush to buy up drilling land Diamondback Energy to buy Endeavor Energy Resources, after IEA warning against new fossil fuel developments"
2024-02-13,Tui investors vote to leave London Stock Exchange amid record results More than 98% of shareholders in Europe’s biggest travel operator vote to delist in favour of Germany
2024-02-13,"The Body Shop UK falls into administration; UK wage growth and US inflation hit rate cut hopes – as it happened The Body Shop has collapsed into administration in the UK, less than three months after it was taken over by a private equity company"
2024-02-14,"Signs of UK housing market recovery as price falls ease Price of average property decreased by 1.4% in 12 months to December, says ONS"
2024-02-14,Virgin Money faces investor backlash over CEO David Duffy’s £2.6m pay deal Investment adviser raises ‘accountability’ concerns regarding reward 37 times higher than average employee’s
2024-02-15,Rishi Sunak warned against fresh austerity drive to finance tax cuts Unions outraged as Jeremy Hunt said to be considering cutting public spending to balance books in next month’s budget
2024-02-15,"Britain is in a rut. Here are five ways to fix the economy From unfreezing tax thresholds to boosting social housing, solutions to the UK’s problems don’t have to trigger the return of inflation"
