date,text
2020-01-01,"From JD Sports to Games Workshop: best market performers of decade Tesco, Sainsbury’s, Standard Chartered and BP among the laggards over the past 10 years"
2020-01-01,"US election, Brexit and China to sway the markets in 2020 Investors expect a strong year but the presidential race and trade wars could spring nasty surprises<br>"
2020-01-02,"UK economy in stagnation at end of 2019, survey shows British Chambers of Commerce report says long-term uncertainty is impeding growth"
2020-01-02,"Brexit jitters weigh on pound, boosting Britain's blue-chip stocks - as it happened Rolling coverage of the world economy and financial markets as the looming Brexit date weighs on the value of the pound, propping up the FTSE 100"
2020-01-02,Financial markets surge after £87bn Chinese cash increase Record high on Wall Street and share rises in Europe following US-China trade deal progress
2020-01-03,"Royal Dutch Shell may fail to reach green energy targets With a year to go, oil firm’s $2bn investment is well below its own guidance of $4bn-$6bn "
2020-01-03,Oil prices spike after US drone strike kills Iranian general Brent crude up 3% amid escalating Middle East crisis that could hit world economy<br>
2020-01-04,"Debt will kill the global economy. But it seems no one cares Warnings from the IMF and World Bank have been dismissed. But even if they are wrong, a demographic crisis looms"
2020-01-05,"Even for this resilient bull market, the threats are starting to multiply Trading has been buoyant through recent turbulence, but tensions in Iran – or a rise in the base rate – might change that"
2020-01-06,"40% rise in public companies opting to leave stock exchange Data for 2019 shows value of private equity firms snapping up public companies doubled to £21.1bn, up from 2018"
2020-01-06,"Oil hits $70 and stocks slide as US-Iran tensions rise – as it happened Rolling coverage of the latest economic and financial news, as Middle East crisis drives crude prices up"
2020-01-06,"Top FTSE bosses paid typical worker's annual salary in just 33 hours High Pay Centre figures should be ‘source of national shame’, say unions"
2020-01-07,Woodford fund debacle shows an investment industry high on hubris Dividend of £13.8m to founder and partner came as fund’s value was already sinking fast
2020-01-07,"Woodford and partner took £13.8m dividend in run-up to fund crisis About 300,000 investors have money trapped in former star stock-picker’s flagship fund"
2020-01-07,Big four supermarkets lose Christmas sales as 'Boris bounce' fails to appear Morrisons blames ‘unusually challenging’ market with shoppers worried about Brexit
2020-01-07,IMF boss says raise taxes on the rich to tackle inequality Kristalina Georgieva calls for rethink of economic policies to better help those left behind
2020-01-08,Carlos Ghosn insists he is innocent over fraud charge 'plot' – business live Rolling coverage of the latest economic and financial news
2020-01-08,"World Bank warns of global debt crisis amid borrowing buildup Current debt wave is largest, fastest and most broad-based since 1970s, say economists"
2020-01-08,Why Iran crisis is unlikely to hit US consumers hard at the gas pumps Rumors of Middle East war used to inevitably lead to soaring gas prices but fracking revolution has changed the market landscape
2020-01-08,"Greggs to pay workers £7m bonus after vegan sausage roll success Bakery chain’s 25,000 employees will receive up to £300 in this month’s pay packet"
2020-01-09,"Investors face £230m loss in London Capital & Finance collapse Only 159 mini-bond customers affected by scandal due to be compensated, says FSCS"
2020-01-09,Marks & Spencer sales hit by too many mince pies and skinny jeans Shares slide as stock-buying errors and rivals’ Christmas discounts dent performance
2020-01-09,'Return the dividend': Woodford investors blast £13.8m windfall Anger over news stock-picker and business partner shared sum in run-up to fund collapse
2020-01-09,"Wall Street hits record highs; UK rate cut hint hurts pound - as it happened BoE governor warns that UK economy may not rebound, as John Lewis and Marks &amp; Spencer issue weak Christmas trading updates"
2020-01-09,Tesco sales win out in subdued Christmas for UK supermarkets Leading grocer reports small results fall compared with last year at established stores
2020-01-09,John Lewis boss quits as chain warns it may ditch bonus Department store chain and Waitrose owner says dip in key Christmas sales dented profits
2020-01-09,The decisions facing John Lewis as it tries to halt fall in profits Sharon White will have the challenge of a new management structure when she arrives as chair
2020-01-10,"Ousted Boeing CEO Dennis Muilenburg to receive $60m in stock and pension Muilenburg left after two 737 Max aircraft crashed, killing 346 and Boeing says ex-CEO will forfeit stock worth $14.6m"
2020-01-12,"Johnson can now deliver a ‘Brexit in name only’. Will he? If the PM were the one nation Tory he claims to be, he would – and should – choose to keep Britain aligned with the EU"
2020-01-12,Sajid Javid must deliver a UK budget that works quickly – a tricky task The Tories need to satisfy their new northern voters fast. Not easy given the economic problems are structural
2020-01-12,Review hammers home problems with Persimmon Housebuilders are enjoying their usual new year boost – and the Tory election win – but this could all turn out to have shaky foundations
2020-01-13,"Avoid UK recession by kickstarting green economy, says thinktank New Economics Foundation calls for £50bn to reboot economy on greener footing"
2020-01-13,UK GDP: economy shrank in run-up to election Pressure on Bank of England for interest rate cut increases after figures for November
2020-01-13,"Pound slides as UK economy shrinks in November – as it happened Rolling coverage of the latest economic and financial news, as UK slowdown persists and airline Flybe seeks help"
2020-01-13,MPC may need more data before it considers cutting interest rates Bank of England panel meets this month after weak economic figures for November
2020-01-13,UK house sales rising after Boris Johnson's election win – Savills Estate agent says buyers are regaining confidence but full effect of Brexit is still unknown
2020-01-13,Flybe on the brink as government urged to step in Europe’s largest regional airline seeks state bailout to stave off collapse
2020-01-13,Passengers on Flybe's troubles: 'There’s no other way I can get to work' Customers of beleaguered airline tell how its collapse would impact their lives
2020-01-14,"BlackRock promises climate action, but Extinction Rebellion demands more - as it happened Asset management giant promises to put environmental issues at the heart of its investment strategy"
2020-01-14,BlackRock now needs to use its voting clout to fuel sustainable investing It’s good news the world’s largest asset manager aims to change how it invests but actions will speak louder than words
2020-01-15,US says 'flash crash' trader should not face further prison time Navinder Singh Sarao has been helping DoJ build cases against other suspected market cheats
2020-01-16,"US-China tensions could slow global economy, UN warns Report says climate crisis, inequality and food insecurity were major concerns"
2020-01-16,"Doubts linger over US-China trade deal, but Dow hits record high – as it happened Rolling coverage of the latest economic and financial news, as experts express concerns over Donald Trump’s Phase One trade deal with China"
2020-01-16,"UK electric van maker Arrival secures £85m from Kia and Hyundai Investment from Korean giants means startup is valued at £3bn, giving it ‘unicorn’ status"
2020-01-17,Oxo to launch vegan beef-flavoured stock cubes Meat-free version of venerable brand comes amid boom in sales of plant-based food
2020-01-17,IMF boss says global economy risks return of Great Depression Kristalina Georgieva compares today with “roaring 1920s” and criticises UK wealth gap
2020-01-17,"High street gloom continues as fears grow over UK economy Retail sales fail to rise for record fifth month in a row in December, says ONS"
2020-01-17,"Big pharma  failing to invest in new antibiotics, says WHO Health body says there are alarmingly few drugs in the pipeline to deal with growing resistance"
2020-01-17,Global markets rise despite slowest Chinese growth for 30 years Investors shrug off slowdown as new data fuels optimism China can ride out US trade war
2020-01-17,UK channels aid budget as it seeks closer ties with Africa post-Brexit £395m trade boost is aimed at countering China’s spending on the continent
2020-01-17,Former Neil Woodford fund to reopen 'no later than February' Smaller LF Woodford Income Focus Fund worth £268m was frozen as crisis deepened
2020-01-17,FTSE 100 at six-month high; UK retail sales slide – as it happened Rolling coverage of the latest economic and financial news
2020-01-18,"If the UK doesn’t act now, the car industry will vanish Brexit was the latest blow to the sector. Its future must not be left to the market – investment in electric vehicles is needed"
2020-01-19,"Shopping centre chain seeks up to £1bn to shore up finances Intu, the owner of the Trafford Centre and Lakeside, is struggling with £5bn debt pile<br>"
2020-01-20,UK brewers invest in low-alcohol drinks trend Brewdog to open alcohol-free beer bar in London as ‘nolo’ sales rise 18% in western Europe
2020-01-20,"A new decade is likely to bring another year of low wages growth Low inflation reflects sluggish demand in the economy, and the bushfires have already created a hit on consumer confidence"
2020-01-20,Greenpeace hits out at Davos banks for $1.4tn climate hypocrisy Report highlights financial support given to hydrocarbon sector by 24 institutions
2020-01-20,Davos 2020: PwC chairman says dos Sandos affair 'not our finest hour' – as it happened IMF warns of ‘sluggish’ economic outlook as it cuts its growth forecasts
2020-01-21,Lloyds set to halve carbon emissions it finances in 10 years Bank vows to create ‘green products and services’ such as energy efficiency mortgages
2020-01-21,Buoyant jobs market eases pressure on Bank of England to cut rates Number in employment hits joint record high of 32.9 million in three months to November
2020-01-21,"EasyJet's grab of Thomas Cook spoils won't be flying too high Since it’s only adding 3% capacity in 2020, airline seems hardly engaged in post-bust market grab"
2020-01-22,"Reshape economy to fight climate crisis, says Prince Charles Davos delegates told what good is extra wealth ‘if you can do nothing but watch it burn?’"
2020-01-22,Carney sides with Greta Thunberg against Trump over climate Bank of England governor backs environmental activist’s stance on global heating 
2020-01-23,World financial markets rocked by China coronavirus Oil and travel shares slide amid fears outbreak could hit growth in second largest economy
2020-01-23,World Bank chief's Davos snub dashes hopes of climate consensus David Malpass spurning event hits efforts to tackle issues of poverty and climate crisis
2020-01-23,Andrew Bailey to be quizzed on regulator's role in LC&F scandal Outgoing head of the Financial Conduct Authority takes over at Bank of England in March
2020-01-23,"Morrisons to cut 3,000 managers and take on more shop-floor staff Supermarket seeks to fill 7,000 new hourly-paid roles in overhaul of store operations"
2020-01-23,Handmade Burger Co in administration with loss of 283 jobs All 18 outlets of restaurant business shut down after it failed to find a buyer
2020-01-23,Record Black Friday drives Asos recovery after profit warnings Fashion retailer’s overall sales up 20% to £1.1bn in the four months to 31 December
2020-01-24,Pressure eases on Bank to cut interest rates as UK economy improves January’s stronger PMI data means Bank of England is more likely to hold rates next week <br>
2020-01-27,"Stocks and oil slump on fears over China virus outbreak – as it happened Equity sell-off deepens and oil falls below $59 as death toll from coronavirus rises, sparking fears over economic impact; stock markets in UK, Germany and France fall more than 2%"
2020-01-27,Global markets slide on back of coronavirus concerns in China Companies begin pulling staff from centre of outbreak or impose travel restrictions
2020-01-27,£30bn pension fund: we'll sack asset managers that ignore climate crisis Brunel Pension Partnership sets 2022 deadline for investment firms to reduce exposure
2020-01-28,Sainsbury's in £1bn investment to become carbon neutral by 2040 Retailer’s plans include cutting down on waste and a plastic bottle deposit scheme
2020-01-28,Neil Woodford loyalists pay dearly for stock-picker's style drift Winding up of flagship fund should also be a big lesson for Hargreaves Lansdown
2020-01-28,Global firms halt China travel as coronavirus spooks markets Fears grow over global economic fallout with airline shares hit and commodity prices tumbling
2020-01-28,"Markets recover some losses amid coronavirus growth fears - business live Rolling coverage of the latest economic and financial news, as some Asia-Pacific markets continue to slide"
2020-01-28,John Lewis to replace weekly sales updates with twice-yearly ones Struggling retailer’s weekly data was used by City analysts to gauge high-street conditions
2020-01-29,"Gig economy traps workers in precarious existence, says report Doteveryone thinktank says workers suffer from financial insecurity and loss of dignity"
2020-01-29,Bank of England’s interest rate decision is finely balanced A post-election bounce fuelled by the housing market means rate setters will seriously consider a rise<br>
2020-01-30,"How has Brexit vote affected UK economy? January verdict Each month we look at key indicators to see what effect the Brexit process has had on growth, prosperity and trade"
2020-01-30,UK economy close to turning point on eve of leaving EU Confidence rising three and a half years after Brexit vote but tight timescale for trade deal could harm recovery<br>
2020-01-30,Is uncertainty lifting now Brexit is finally happening? Experts debate the data Two former members of Bank of England’s rate-setting committee on Britain’s economic prospects
2020-01-30,"Huawei ruling will cost us £500m, says BT Telecoms group faces big bill for stripping out banned equipment from 5G broadband"
2020-01-30,"Taken for a ride: how Norton Motorcycles collapsed amid acrimony and scandal Exclusive: Guardian/ITV investigation reveals how pension holders, customers and staff lost out"
2020-01-30,Bank of England holds UK interest rates; US misses Trump's growth target — as it happened Mark Carney holds press conference after setting UK interest rates for the last time before he leaves in March
2020-01-31,"Eurozone growth slows sharply as French and Italian economies shrink – as it happened Rolling coverage of the latest economic and financial news, as France’s economy contracts by 0.1% in the last quarter"
2020-01-31,"Change climate policy now to avert oil market crisis, warns thinktank Governments risk derailing global fossil fuel demand with ‘handbrake turns’ in future"
2020-01-31,Aston Martin to enter F1 from 2021 under £500m rescue deal Lawrence Stroll’s consortium saves carmarker from collapse with £182m investment
2020-01-31,"Transvaginal mesh: Johnson & Johnson fined $344m for deceptive marketing to women Company ‘knew the danger of its mesh products but put profits ahead of the health of millions of women’, says California attorney general"
2020-01-31,"Eurozone growth close to stalling as French and Italian GDPs shrink Brexit could further damage bloc’s economy, which grew just 0.1% in final quarter of 2019"
2020-02-01,"Fears of global economic slowdown as virus follows trade war China, and the world, were already burdened by tariffs. Now, some say the coronavirus could undermine fragile growth"
2020-02-02,1.2tn yuan to be pumped into Chinese markets to fight coronavirus slump China’s central bank also announces support for hospitals at frontline of battle against outbreak
2020-02-03,"Bushfires and the coronavirus will hit Australia's economy – but they won't knock it out While the Reserve Bank will most likely need to cut rates again earlier than it otherwise would, talk of a recession is premature"
2020-02-03,Pound falls sharply as Boris Johnson prompts hard Brexit fears – as it happened Central bank blames herd effect as investors count cost of outbreak<br>
2020-02-03,"Guessing how markets will react to coronavirus is a fool's errand The stock markets recovered quickly from Sars in 2002, but China is a very different place now"
2020-02-03,"Global markets rally after biggest Chinese fall in five years Despite coronavirus concerns, share prices stabilise over hopes it can be contained"
2020-02-03,Ofgem sets out nine-point plan to prioritise climate crisis Regulator aims to support investment in low-carbon technology while protecting households from price rises
2020-02-03,"Chinese shares drop nearly 9% amid fears of coronavirus impact As businesses in China remain shuttered and travel bans mount, crude oil and shares in Australia and Japan also take a hit"
2020-02-03,"Nissan 'could pull out of EU and expand in UK after hard Brexit' Carmaker considers focusing on UK market if there are tariffs on exports, according to report"
2020-02-04,"Opec discusses coronavirus as Chinese oil demand slumps – as it happened Oil cartel and its allies including Russia meet in Vienna after oil enters bear market; calm returns to world stock markets, which rise for a second day"
2020-02-05,Coronavirus threatens Australian economy reeling from drought and fires Reserve bank governor Philip Lowe says latest outbreak could wreak more economic damage than Sars
2020-02-05,UK economy rebounds as services sector hits 16-month high More clarity since election bolsters consumer spending and business investment 
2020-02-05,"The RBA is upbeat about the economy, but we need a more effective measure than GDP Relying on GDP to decide if we are in a recession is silly, the unemployment rate should be the measure"
2020-02-05,"Shares and oil prices jump after Chinese report of coronavirus treatment – as it happened Rolling coverage of economics, business and markets as UK services grows at fastest since September 2018"
2020-02-06,"European stocks hit record high despite coronavirus outbreak – as it happened Rolling coverage of economics, markets and business as Chinese tariff cuts on US goods help to stimulate markets to record highs<br>"
2020-02-06,"Experts sound alarm over PM's pledge to 'level up' UK economy Boris Johnson would need two full terms as PM to fulfil election vow, says thinktank"
2020-02-07,Tidjane Thiam: the man who traded politics for finance after military coup Ousted Credit Suisse chief transformed Prudential before City regulator censured him
2020-02-07,"US economy boosted by 225,000 jobs in January- business live Rolling coverage of the latest economic and financial news, after data showed 225k jobs were added to the US economy in January"
2020-02-07,Credit Suisse chief Tidjane Thiam ousted after spying scandal The 57-year-old loses boardroom battle with Thomas Gottstein set to replace him
2020-02-08,Women hold a third of board roles in UK's top public companies But government’s Hampton-Alexander review is struggling to reach second major gender diversity target
2020-02-09,High time to invest in the north's infrastructure Dithering over HS2 undermines the credibility of Boris Johnson’s promised infrastructure revolution
2020-02-10,The stumbling Australian economy needs rescuing Household wallets were closed tight even before the hit from bushfires and the coronavirus. It’s time for government spending 
2020-02-10,Smartphone production to slump as coronavirus crisis hurts investor confidence – business live Rolling coverage of the latest economic and financial news
2020-02-10,Ex-Virgin Money chief joins cultural shake-up at Lloyd's of London Insurance market hit by bad behaviour allegations in 2019 appoints Jayne-Anne Gadhia
2020-02-11,UK GDP: British economy stalls amid political uncertainty Zero growth figure reflects impasse in the final three months of last year
2020-02-11,UK economy can bounce back – but don't expect boom-boom Britain Prospects for GDP growth look positive after flat figures for the end of last year
2020-02-11,"UK GDP: British economy stagnates as Brexit uncertainty hits growth - as it happened Rolling coverage of the latest economic and financial news, including how well (or badly) Britain’s economy performed in the face of Brexit and the general election"
2020-02-11,"JD Sports may have to sell Footasylum, says competition watchdog CMA inquiry provisionally finds shoppers could lose out in merger but sportswear retailer brands findings flawed"
2020-02-11,Blow for Lakeside owner Intu as investor shuns £1bn cash call Hong Kong-based Link pulls out of refinancing plan a day after talks were confirmed
2020-02-12,"Markets rally despite fears coronavirus will hit growth and earnings - as it happened Rolling coverage of the latest economic and financial news, as Europe’s <strong>Stoxx 600</strong> index and Germany’s <strong>Dax</strong> hit fresh peaks"
2020-02-13,"Alibaba and JCB hit by coronavirus problems as oil demand slashed - as it happened Rolling coverage of the latest economic and financial news, as e-commerce giant Alibaba, digger maker JCB and fashion chain Ralph Lauren warn about coronavirus impact"
2020-02-13,"House prices rise across UK for first time since July 2018 Optimism returns to housing market, with some crediting ‘Boris bounce’ for revival "
2020-02-13,"Vodafone and TPG $15bn merger given green light by federal court The ACCC opposed the merger, arguing it would discourage competition in the market"
2020-02-14,Shake it off! Taylor Swift label Universal Music plans stock market flotation Record label home to fabled acts such as the Beatles plans to list the $30bn company within three years
2020-02-14,"German economy stagnates as eurozone growth hits seven-year low - business live Rolling coverage of the latest economic and financial news, including the latest eurozone growth figures"
2020-02-14,Thames Water steps back from regulator revolt UK’s largest water firm opts not to join rebellion against Ofwat’s crackdown on profit levels
2020-02-15,"‘Black swan’ coronavirus casts its shadow over the global economy Airlines have grounded flights, banks have sent staff home. In China and worldwide, the virus has taken its toll"
2020-02-16,Outgoing Bank of England head to face questions over audio leak Mark Carney and successor Andrew Bailey may be called in to explain hedge funds’ early access to press audio feed
2020-02-17,"Japan's economy heading for recession, and Germany wobbles International trade slump and coronavirus outbreak combine to weaken consumer demand"
2020-02-17,Japan's economy on brink of recession; Cathay's profits warning - as it happened Rolling coverage of the latest economic and financial news
2020-02-17,Companies paid record $1.43tn in dividends in 2019 Rise driven by strong market performances in North America and emerging economies 
2020-02-17,"JD Wetherspoon to serve only Fairtrade sugar in pubs Move will boost market for fairly traded goods in the UK, worth about £1.6bn"
2020-02-17,"First-home buyers flex their muscles as investors lose their oomph Owner-occupiers are driving the market, keeping housing affordability relatively steady and the Reserve Bank happy"
2020-02-17,"For all the brave words, Jupiter's move is essentially defensive The UK’s fund management industry is losing the war against index tracking"
2020-02-18,Apple shares drop after coronavirus warning; Jaguar Land Rover faces parts shortage – business live Rolling coverage of the latest economic and financial news
2020-02-19,"UK cash economy close to collapse, campaigners tell chancellor Rishi Sunak urged to enshrine right to access cash in budget with 8m people at risk of exclusion"
2020-02-19,"UK inflation jumps to six-month high of 1.8% – as it happened Rolling coverage of business, economics and markets as British prices rise faster than expected <br>"
2020-02-20,"Employers can’t forbid romance in the workplace – but they can protect workers While workplace romances aren’t against the law, certain behaviors could cross an ethical line – but there are models that work"
2020-02-22,"Cliffhanger for small investors who poured money into Yorkshire mine Thousands of locals bought stock in a new potash mine near Whitby. But the money ran out and big business moved in, leaving shareholders with a tricky choice"
2020-02-22,"Getting to zero net emissions in 2050 is going to be tough - but Labor committing to it is a damn good thing It won’t be an easy task, but achieving zero net emissions will have a huge payoff for both the economy and the nation"
2020-02-23,"When No 10 moves in to No 11, the result can be chaos If Javid’s departure means austerity is over, then thank heavens. But Tories also have a history of overheating the economy"
2020-02-24,Stocks fall as coronavirus fears hit global markets Shares on Wall Street tumble after surge in cases of virus in Italy 
2020-02-24,"Wall Street plummets as coronavirus spreads in Europe – as it happened Rolling coverage of business, economics and markets amid concerns over extent of outbreak beyond China<br>"
2020-02-25,"FTSE 100 hits one-year closing low, as Wall Street slides again – as it happened European markets have suffered a second day of heavy losses as new coronavirus cases are reported<br>"
