date,text
2022-07-07,Pound bounces back on news of Boris Johnson’s resignation Political chaos had driven sterling to lowest level in two years but traders hope for less strife under next PM
2022-07-08,"Boris Johnson has left the UK economy in a parlous state Analysis: If Johnsonomics stands for anything, it is a lack of plan or vision to address Britain’s economic woes"
2022-07-08,"Six charts that show how the UK economy is in crisis From inflation to tax, labour shortages to R&amp;D, ministers will need to confront these key issues and fast"
2022-07-08,"Britain’s energy price cap heading for £3,300; US jobs report eases recession worries – as it happened  Cornwall Insight predicts UK energy cap will rise to £3,363 a year in January, as US economy shakes off recession worries by adding more jobs last month"
2022-07-09,Tory turmoil keeps Bank of England in the dark on tackling crisis Policymakers can only wait and see how the next prime minister’s tax and spend policies will affect the economy
2022-07-09,Woking’s towers: the high-rise symbol of local council debt  Cash-starved authorities turned to property development to beat austerity –but none more so than one town in Surrey
2022-07-11,"China lockdown worries hit stocks; Uber and Twitter shares fall; Wizz Air to cut more flights – as it happened Shares hit as China try to quell resurgent Covid-19 outbreaks, while shares in Twitter drop after Musk tries to cancel takeover, and Uber is hit by leak"
2022-07-11,"Aslef boss Mick Whelan: ‘There’s no cost to the economy in running rail properly’ Head of train drivers’ union takes pride in calling very few strikes – but enough is enough, he says"
2022-07-12,"Average UK household £8,800 a year worse off than those in France or Germany Thinktank blames inequality and poor productivity as CBI calls for investment policies to fuel growth"
2022-07-12,Bill Ackman to wind up Spac and return $4bn to investors Billionaire says he failed to find a suitable company to take public using his investment vehicle
2022-07-12,"Klarna’s road ahead looks a little harder this year With Apple set to enter the market and shrinking appetite for tech stocks the future looks less rosy for buy now, pay later firm"
2022-07-13,"UK economy returns to growth thanks to holiday boom and GP visits GDP rose by 0.5% in May after revised 0.2% decline for April, says ONS"
2022-07-13,"US inflation hits new 40-year high; euro dips below dollar for first time since 2002 – as it happened Stocks fall after US inflation jumps to 9.1%, as UK economy grows faster than expected by 0.5% in May"
2022-07-13,Surprise news of UK growth masks increasing pain from inflation <strong>Analysis:</strong> May is only one month and there is likely to be a sharp contraction in June
2022-07-14,JP Morgan Chase sets aside funds to cover feared loan losses  Largest US bank saw net income fall 28% from April to June and is concerned about economy and geopolitical tensions
2022-07-15,Copper price at lowest level since 2020 as fears over global economy grow Fall comes amid concerns that soaring inflation will curb spending by large manufacturers
2022-07-15,Aston Martin raises £650m as Saudi Arabia takes a stake Executive chairman ‘very comfortable’ with investment to help British manufacturer pay down large debts
2022-07-15,"China’s economic growth slumps sharply after Covid lockdowns Shutdown of cities takes its toll, while property market remains in crisis and global outlook darkens"
2022-07-16,"Andy Haldane: we can fix the cost of living crisis. But will we? The Bank of England’s former chief economist has a clear idea of what caused the current inflation mess, but fears the UK lacks any clear plan for solving it"
2022-07-18,GSK spin-off Haleon begins trading in biggest European listing in a decade Consumer health company ends first day on London Stock Exchange with £28.5bn market valuation
2022-07-18,UK energy users could be offered cheap rates when demand is low Government consults on ‘biggest electricity market shake-up in decades’ amid soaring bills
2022-07-18,Jim Chalmers warns of ‘confronting’ inflation and wages forecast in July economic update Treasurer says rising interest rates will affect economic growth but Labor has plans to provide cost-of-living support
2022-07-19,"UK pay falls at fastest rate on record as inflation bites – as it happened Jobs data from the Office for National Statistics shows real terms pay, which accounts for inflation, fell 2.8% between March and May"
2022-07-19,"‘A lot of challenges’: can housing industry build homes habitable in high temperatures? The UK’s housing stock must be resilient to rising heat levels, experts warn, with retrofitting of older properties also needed"
2022-07-19," If Liz Truss’s big idea really is to remodel monetary policy, expect markets to take fright Tory leadership candidate must clarify her comments on independence of Bank of England – and sharpish"
2022-07-19,"As Australian job vacancies double, which sectors are facing the biggest labour shortages? With almost full employment, nearly everyone willing and able to work is in a position already. So which industries are feeling the squeeze, and why?"
2022-07-19,SoftBank ‘halts plans’ for Arm’s London listing amid political instability Loss of UK chip designer’s flotation would jeopardise capital’s attempt to prove it can compete against US
2022-07-20,BP admits windfall tax will not affect its North Sea investments after all Executive tells MPs new clarity on levy’s December 2025 end date means it no longer needs to review investments
2022-07-20,"Half-point interest rate rise ‘on the table’ next month, says Bank of England chief Andrew Bailey also announces plan to sell off some of Bank’s bonds stock to reinforce effect of higher rates in tackling inflation"
2022-07-20,Royal Mail threatens to split up business as it reports £1m a day loss Warning comes amid falling revenue and parcel volumes and fear it is facing the biggest strike of summer
2022-07-21,"Next PM must get a grip on net zero plans or deter investment, warn Lords Influential committee says UK must join dots between policies to plug gap between ambition and delivery"
2022-07-21,"ECB raises interest rates more than expected to combat inflation – as it happened ECB raises rates by half a point in its first hike in 11 years, UK government finances worsen amid record debt interest costs and Russia resumes limited gas supplies to Europe"
2022-07-22,"Rising interest rates will hit already weak UK economy, output shows Latest snapshot of private sector activity reveals manufacturing and services struggling with rising costs"
2022-07-22,"Holidaymakers warned of Dover ferry queues; survey shows UK economy slowing – as it happened Rolling live coverage of business, economics and financial markets as retail sales and factory surveys suggest UK economy losing momentum"
2022-07-22,"Just hot air? For all the Farnborough talk, zero-carbon flying remains years away Record heat reaffirms urgency to decarbonise, but technical challenge is far greater for aviation than for most other parts of economy"
2022-07-24,"Supercar sales accelerate in the UK Low-cost finance and a ‘you only live once’ attitude behind 19% rise in the likes of Ferraris, Lamborghinis and Maseratis, say market analysts"
2022-07-25,"Ministers, one fears, still haven’t grasped scale of Ofgem’s regulatory failure Business committee right to be sceptical about ability to reform UK energy market in damning report"
2022-07-26,"UK e-commerce firm THG ends investment deal with Japan’s SoftBank Company, which owns sites such as Lookfantastic and Zavvi, blames ‘global macroeconomic conditions’"
2022-07-26,"IMF says global economy is edging towards recession Fund cuts forecasts as US, China and eurozone stall and inflation beats expectations"
2022-07-26,IMF outlook for world economy could herald dark clouds for Australia Analysis: Treasurer Jim Chalmers will no doubt reveal inherited budget bungles but he won’t need to look far for new tales of economic woe
2022-07-26,"IMF warns world economy may soon be on the cusp of recession – as it happened International Monetary Fund cuts global growth forecasts as outlook darkens and inflation climbs, with UK seen as slowest-growing G7 member in 2023"
2022-07-27,"Jim Chalmers to cut economic growth estimates amid inflation ‘headwinds’ Treasurer will use state of the economy speech to trim 2021-22 growth to 3.75% and provide new inflation, wage and unemployment forecasts"
2022-07-28,"US economy shrinks in second quarter, signaling unofficial start of recession The bad news will be a major blow for the Biden administration as it prepares for a tough midterm election season"
2022-07-28,"Ex-Carillion executives face £1m in fines over ‘market abuse’ claims Richard Howson, Richard Adam and Zafar Khan appeal against watchdog findings that they ‘acted recklessly'"
2022-07-28,"With such eye-watering profits, Shell should invest more in low-carbon transition Shell could afford to allocate far greater sums to investment but is choosing not to do so"
2022-07-28,"Diageo sales up 20% amid thirst for ‘super-premium’ spirits International market for scotch, tequila and Chinese spirits grows as customers trade up to more expensive brands"
2022-07-28,Biden says US economic slowdown due to Fed inflation-fighting measures – as it happened US president says growth affected by moves to tackle inflation as US enters technical recession
2022-07-28,Fed announces another three-quarter-point increase in interest rates  The move is intended to curb inflation though previous increases this year have had little effect so far
2022-07-28,"Australia’s inflation rate to peak at 7.75% in December quarter, economic update predicts Treasurer Jim Chalmers tells parliament that nation is facing a ‘once-in-a-generation’ challenge and real wages won’t grow until 2023-24 fiscal year"
2022-07-29,"ExxonMobil and Chevron shatter profit records; eurozone inflation hits record 8.9% – business live US oil companies post huge earnings, as sky-high fuel costs hit consumers and drive up inflation"
2022-07-30,"How strong is the US economy? Depends on which party you ask Analysis: In spite of high employment and robust hiring, many Americans are pessimistic about the economy"
2022-08-01,"UK businesses slash investments due to soaring prices and Brexit As many firms are now planning to cut investment as to increase it, latest polls find"
2022-08-03,Pelosi’s Taiwan trip could have significant consequences for global economy Rising tensions between US and China threaten to accelerate decoupling of world’s two biggest economies
2022-08-03,Australia’s economy is set to grow slower than it ever has outside of recession. This is bad news for our standard of living The economic growth forecasts are truly dire and point to rising unemployment and falling wages growth
2022-08-03,"Opec approval of minuscule oil output rise is insult to Biden, say analysts Increase in production by 100,000 barrels a day described as ‘so little as to be meaningless’"
2022-08-04,Massive queues in Moscow as shoppers take last chance to shop at H&M Retailer halted operations in Russia after invasion of Ukraine but has reopened for limited time to sell remaining stock
2022-08-04,"As recession looms, the Bank of England’s independence is under threat Analysis: The monetary policy committee has been accused of being asleep at the wheel amid cost of living crisis"
2022-08-05,"US adds 528,000 jobs in July as market returns to pre-pandemic levels Unemployment rate dipped to 3.5% in July, equal to its rate in February 2020 before the Covid-19 pandemic hit the US"
2022-08-05,"UK house prices fall for first time since June 2021, says Halifax Market cools in July as lender warns of impact of higher interest rates and cost of living crisis"
2022-08-08,"UK economy shrank in second quarter according to poll of economists – as it happened Rolling live coverage of business, economics and financial markets as analysts weigh risk of recessions across the world"
2022-08-08,SoftBank CEO ‘ashamed’ of pride in past profits as record losses prompt cost cuts Japanese technology and investment group is seeking to float UK-based chip maker Arm
2022-08-08,Truss and Sunak still haven’t grasped the magnitude of Britain’s cost of living crisis Neither has an adequate plan – but a joint announcement of a generous package of help would boost confidence
2022-08-09,Abrdn announces pre-tax loss of £320m for first half of 2022 Investment group goes into red amid ‘market turbulence’ and withdrawal of £24bn linked to cancelled Lloyds deal
2022-08-09,‘The government’s got to get its hand in its pocket’: Darlington speaks out on the cost of living crisis The ‘red wall’ town plays host to Tory hustings amid worries over fuel bills and Labour ‘gloom’ over winning back control
2022-08-10,E.ON slashes value of investment in Nord Stream 1 by almost £600m German firm’s revaluation represents 58% decline following ‘increased uncertainties’ after Ukraine invasion
2022-08-10,Australian tax data is absolute proof of the gender pay gap across the entire economy The situation is worst in high paying occupations. Only members of parliament see women with a higher median salary
2022-08-10,Britain’s crises have one thing in common: a failure to invest Obsession with efficiency means infrastructure has been run into the ground rather than upgraded
2022-08-10,EDF sues French government for £7bn after being forced to sell energy at a loss Company has to sell power at prices below market rates as ministers try to tackle cost of living crisis and support households
2022-08-10,"Is inflation finally on the decline in the US? It’s complicated Economists say inflation possibly hit its peak, and there are signs the pressures behind it are easing – but it’s hard to say what’s next"
2022-08-11,Boris Johnson warns energy firms soaring bills will damage sector PM attends round table with power firms but no new measures agreed to ease pressure on households
2022-08-12,UK economy shrinks by 0.1% in second quarter as recession looms ONS says two bank holidays to mark Queen’s jubilee contributed to fall in output in June
2022-08-12,"UK economy contracted in second quarter amid cost of living crisis – as it happened Live, rolling coverage of business, economics and financial markets as economists brace for long UK recession"
2022-08-13,Winning bets? Meme stock frenzy of 2021 makes a return Share prices soar for troubled retailers including Bed Bath &amp; Beyond and AMC – but this time dueling hedge funds are playing a part
2022-08-13,"Six interest rate rises in a row? Blame greedy City bankers Higher mortgage costs will hit homeowners and tenants, investment and consumer spending. In a recession. I hope they’re proud of their acquisitive selves"
2022-08-15,"Oil prices drop by $5 to lowest since before Russia invaded Ukraine – as it happened Live coverage of business, economics and markets as Chinese economy shows signs of slowdown and Institute for Fiscal Studies warns on maintaining similar level of energy bills support"
2022-08-16,"Glass half empty or full? The two ways of viewing latest UK jobs figures Analysis: While chancellor says unemployment has rarely been lower, Bank of England predicts recession will push up jobless rate"
2022-08-16,"Annual grocery bills in Great Britain will soar by £533, experts predict Basics such as butter, milk and poultry show biggest increases in figures from market research group"
2022-08-16,Ofwat may want to supply better evidence of being tough on water firms  The regulator approved a rescuer of Southern that hardly had a clean record in the sector
2022-08-18,"RMT chief warns rail strikes could go on ‘indefinitely’ as action halts 80% of services – as it happened First day of new rail and tube strikes begins in disputes over pay, job security and conditions"
2022-08-18,UK consumer confidence weaker than during major recessions Monthly look finds deepening pessimism about personal finances and prospects for the economy
2022-08-18,What problem is Liz Truss’s plan for regulators solving? A future PM will have a huge selection of challenges to choose from. Finance watchdogs should not be on the list
2022-08-18,"Australia’s jobless rate is only 3.4% – so what’s holding wage growth back? That the tight labour market isn’t leading to real earnings rises is proof of a ‘deep structural weakness’, says one economist"
2022-08-18,PwC raises UK partners’ pay to more than £1m for first time Increase in average payouts for accounting firm’s 995 top employees linked to consulting services boom
2022-08-19,Uber’s push into patient transport renews calls for gig economy reform Australia’s transport workers union says company’s move shows gig model of work ‘will pervade every aspect of our lives’
2022-08-19,American dream of owning a home out of reach for many in tight markets Many middle- and lower-income Americans are left with a dwindling number of options or forced into renting while supply increases for the wealthiest buyers
2022-08-19,"Hermès bags and Picassos: business booms for Britain’s posh pawnbrokers Upmarket shops are funding summer spending sprees, while at the other end of the market families pawn valuables to get by"
2022-08-21,UK shoppers are keeping calm and carrying on. Why? Consumers are in either denial about the economy or think they are managing … for now
2022-08-22,AMC stocks drop sharply as investors sour on ‘meme-stock’ rally Movie theatre chain fall 31% while rival Cineworld warns of potential bankruptcy filing
2022-08-22,"Truss poised to plunge UK economy into ‘inflation spiral’, says Sunak Truss cannot deliver £50bn tax cuts and support packages without pushing debt to dangerous levels, says Tory leadership rival"
2022-08-22,Sweet releaf: price of lettuce drops as Australian produce stocks bounce back Growers’ recovery from floods boosts vegetable availability at supermarkets with prices to ease further into spring and summer
2022-08-22,"UK inflation ‘to hit 18%’ as energy bills rocket; recession fears hit markets – as it happened Rising cost of living is “entering the stratosphere” says Citi, which forecasts energy price cap could rise to £5,816 per year in April."
2022-08-22,"Cineworld confirms it is looking at filing for bankruptcy in US Chain, which accumulated £4bn debt in pandemic, says cinemas would stay open and staff be unaffected"
2022-08-24,"Large firms are consolidating power like Scott Morrison consolidates jobs – and it’s hurting productivity In a speech today, the assistant minister for competition, Andrew Leigh, will point the finger at big business over the inflation crisis"
2022-08-25,Czech billionaire’s Royal Mail stake under national security review Daniel Křetínský-controlled Vesa Equity Investment could increase its shareholding to more than 25%
2022-08-26,"Dow plunges 1,000 points after Fed chief Powell warns of inflation ‘pain’ US stock markets nosedive as Jerome Powell says at top bank summit the ‘overarching focus is to bring inflation back down’"
2022-08-26,Energy price cap: Zahawi urges people to cut back on use as charity warns bills could ‘wipe out incomes’ – as it happened Chancellor says ‘we should all look at our energy consumption’ as charity issues warning over ‘stratospheric energy bills’
2022-08-26,"Underquoting in Australian real estate industry is leaving buyers feeling betrayed The only thing that will stop practice of underquoting on price guides is to ‘name and shame’ those caught doing it, says one buyers agent"
2022-08-27,"Britain’s property owners hold all the cards – so hard luck everyone else In the face of energy crises and recession fears, house prices and rents remain robust – because the market is rigged that way"
2022-08-28,Mars bar shortage causing gaps on UK supermarket shelves Shoppers looking for popular chocolate snack encounter empty shelves and ‘out of stock’ messages
2022-08-29,"Point of no return: crunch time as China tries to fend off property crash With the global economy also at a crossroads, Beijing’s leadership faces a perilous test of nerve on its lending crackdown and zero-Covid strategy"
2022-08-30,"Goldman Sachs warns UK inflation could hit 22% in January; German inflation at near 50-year high – as it happened Investment bank warns inflation could exceed 20% if UK energy price cap rises 80% in January, while baseline forecast has inflation rising to almost 15%"
2022-08-30, Wholesale gas prices tumble as Europe prepares to intervene in energy markets European Commission says it is working ‘flat out’ on emergency intervention and on longer-term structural reform
2022-08-30,China’s biggest property developer Country Garden sees profits plunge 96% The company blames the ‘severe depression’ in the property market and says ‘only the fittest will survive’
2022-08-30,A fairer measure of Britain’s wealth Letter: <strong>Peter Danielian </strong>disputes a claim that the UK is the sixth-richest country in the world 
2022-08-31,Demand for crisis support soars even in wealthy UK towns Citizens Advice in affluent Wokingham says requests for help have nearly doubled in a year
2022-08-31,"Pound heads for worst month since 2016 against US dollar; eurozone inflation hits record high – as it happened Pound and UK government bonds have suffered a torrid month, as Rishi Sunak warns of risk that markets lose faith in UK economy"
2022-08-31,"More people leaving workplace pension schemes, TUC warns Growing numbers cannot afford to save for retirement, prompting calls to increase employer contributions"
2022-09-01,UK gas prices fall; growth fears hit markets; pound sinks below $1.16 amid living standards squeeze – business live  Energy prices fall in UK and Europe; Resolution Foundation warns three million more people could be pulled into absolute poverty
2022-09-02,"US added 315,000 jobs in August as strong market defies signs of worsening economy Numbers come as Jerome Powell says Federal Reserve intends to continue interest rate hikes to try to tamp down inflation"
2022-09-02,"Markets rally after US jobs report; G7 ministers back Russian oil price cap; pound under pressure – as it happened US non-farm payroll rose by 315,000 in August, as hiring slowed after a strong July"
2022-09-02,"Credit Suisse weighs up 5,000 job cuts as part of restructuring plan Proposals involve scaling back the investment bank and reducing more than $1bn in costs"
2022-09-03,EV riders: motorcycle manufacturers making the leap to electric British startup Maeving is in the vanguard of a growing market worldwide for clean two-wheeled travel
2022-09-04,"Britain needs an economic strategy – instead we’ve got Liz Truss As we wrestle with the disaster of Brexit and loss of the single market, our next PM is ruining Anglo-French relations"
2022-09-05,"UK economy on brink of recession as Truss takes over, figures show Activity in manufacturing and services fell last month as businesses struggle with soaring costs"
2022-09-05,Liz Truss must try to calm markets’ nerves with a clear stance on Bank independence Analysts are right in greeting new PM with warnings about ‘extreme macro outcomes’ and clarity is now essential
2022-09-06,Economists predict slowdown for Australian economy as interest rates continue to rise Soaring commodity exports and positive agricultural forecast expected to be balanced by Reserve Bank’s moves to counter inflation
2022-09-06,Patrick Minford: maverick economist who inspired Truss and Thatcher Brexiter tells Guardian that new PM understands need for tax cuts and orthodoxy must be challenged to revitalise economy
2022-09-07,Pound falls to lowest level since 1985 against dollar – as it happened IFS boss says Liz Truss’s plans to freeze energy bills ‘very poorly targeted’; Putin threatens to cut off energy supplies if price caps are imposed; UK housing market shows signs of slowing
2022-09-07,Government moves to calm markets as pound falls to lowest level against dollar since 1985 New chancellor on charm offensive in Square Mile says Bank of England independence ‘is sacrosanct’
2022-09-07,"Offensive graffiti, attitudes targeted in NSW bid to improve conditions for female construction workers The ‘culture standard’ will trial family friendly hours, dedicated spaces for women and address pay gaps at two government construction sites"
2022-09-08,Bank of England to lend UK energy companies as much as £40bn Bailout fund provided amid soaring market prices and fears of another wave of collapses
2022-09-08,Lloyd’s of London takes £1.1bn hit from Ukraine war Insurance market warns of financial fallout from conflict and tough year of natural catastrophes
2022-09-08,"Truss energy bill freeze will not come cheap and economic effects are unclear Questions remain over the costs, the funding of the plan and inflation as free-market stance is put to one side"
2022-09-08,ECB raises interest rates across eurozone by record margin European Central Bank sets aside recession fears to increase rates by 0.75 of a percentage point to 1.25%
2022-09-08,"Australia Post says order presents now for delivery by Christmas Postal service chief says recruitment has started for extra 5,000 to 7,000 workers needed in holiday peak but supply chain woes continue"
2022-09-10,"‘She offered an island of certainty and continuity’: the Queen and the City London’s finance hub has changed enormously in 70 years, but royal relationship is woven into its fabric"
