date,text
2021-03-12,Climate experts in dismay at choice of Mathias Cormann as OECD chief Critics say election of former Australian finance minister with ‘atrocious record’ sends a dangerous signal
2021-03-12,Exports to EU plunge by 40% in first month since Brexit Fall in exports worth £5.6bn comes as UK economy in January suffers deepest drop since first wave of Covid pandemic
2021-03-12,Royal Mail to trial Sunday parcel service for big retailers Move comes after what company describes as an ‘unprecedented’ number of deliveries over past year<br>
2021-03-12,Massive drop in UK trade shows extent of Boris Johnson's Brexit own goal Analysis: trade could be a drag on recovery for years to come rather than the high-octane propellent the government promised
2021-03-13,Joe Biden writes a cheque for America – and the rest of the world The president’s $1.9tn stimulus package should lift US GDP by up to 4% – and thus buoy up the whole of the global economy
2021-03-14,"Greggs was on a roll before Covid, but has it passed peak pasty?  The baker’s results this week may foreshadow how much the virus is changing Britain’s shopping and eating habits"
2021-03-15,Deliveroo aims to raise £1bn from London stock market flotation  IPO will mean selling newly issued and existing shares from some current investors
2021-03-15,Public confidence about British economy jumps; Thorntons to close all stores – as it happened Rolling coverage of the latest economic and financial news
2021-03-16,Football Index seeks buyer amid widespread customer fury John Whittingdale holds talks with betting regulator over self-styled ‘stock market of football’
2021-03-16,"Greggs first loss since 1984; Nokia cutting up to 10,000 jobs; Buy2LetCars in administration – as it happened Rolling coverage of the latest economic and financial news"
2021-03-17,Courts close in on gig economy firms globally as workers seek rights Companies such as Uber and Deliveroo have lost a string of cases in at least 40 legal challenges
2021-03-17,From Tipperary to Silicon Valley: how Stripe became vital cog in digital economy Brothers Patrick and John Collison’s online payments empire is now valued at $95bn
2021-03-17,"Insurer AIA agrees to pull out of all coal investments by 2028 Hong Kong-based firm, whose logo appears on Spurs shirts, has bowed to pressure from activists<br>"
2021-03-17,"Investors in collapsed Buy2Let Cars face losses, FCA confirms Firm fell into administration last week after City regulator ordered it to stop accepting new investment"
2021-03-17,Covid-19 jabs for staff 'should be our call' say 58% of UK managers Moral minefield as CMI poll finds opinion split on whether to restrict workplace for employees refusing vaccination
2021-03-18,"Poorest countries will suffer most from Covid downturn, says UN Unctad agency says international cooperation has fallen well short of what is needed given scale of crisis"
2021-03-18,Bank of England leaves UK interest rates at 0.1%; bond selloff continues – as it happened Rolling coverage of the latest economic and financial news 
2021-03-18,"Bank of England more upbeat on UK job prospects after Sunak budget With the economy looking more resilient than expected under Covid, setting committee keeps rate at 0.1%"
2021-03-19,"Star stock-picker James Anderson retires from Baillie Gifford Anderson was early to spot potential in technology firms such as Tesla, Amazon and Alibaba"
2021-03-19,"UK borrowing surges to February record; consumer morale at one-year high – as it happened Government stake in NatWest reduced to just under 60%, as Bank of Japan edges away from monetary stimulus"
2021-03-19,BT to invest £12bn in faster broadband and reaching remote areas Telecoms regulator Ofcom unveils financial incentives to help achieve government’s ‘gigabit’ UK plan
2021-03-21,"After Uber's U-turn, ministers must stop giving gig economy bosses an easy ride It’s a step forward that Uber drivers must now be treated as employees, but there’s still a long road to travel"
2021-03-21,Cycling boom rolls on amid struggle to meet UK demand during Covid Retailers report customers snapping up all available stocks with bike sales up over 40% on last year <br>
2021-03-22,Turkey’s lira and stock market tumble; travel stocks hit by holiday worries – as it happened Rolling coverage of the latest economic and financial news 
2021-03-22,"London Stock Exchange boss's pay nearly tripled after Refinitiv takeover David Schwimmer got a base salary of £800,000, a £1.4m bonus and £4.3m in long-term bonus shares"
2021-03-22,"A year of Covid lockdowns has cost the UK economy £251bn, study says Some of the poorest areas will suffer disproportionate burden for longer if government does not act, warns CEBR"
2021-03-22,"Bouquets of flowers are now 'substitute hugs', says booming florist Online firm Bloom &amp; Wild doubled sales thanks to the pandemic and its letterbox-sized packages"
2021-03-23,PensionBee to float on London Stock Exchange Online pension provider becomes latest firm to announce London IPO with market value put at £350m
2021-03-23,European lockdowns hit travel firms and oil price – as it happened  Rolling coverage of the latest economic and financial news
2021-03-23,"New breed of young investors are taking big risks, warns FCA City watchdog says Instagram and TikTok are influencing investments such as bitcoin and foreign exchange<br>"
2021-03-23,"Demands and pressures of working from home  Letters: <strong>Tom Schuller </strong>believes the disruption to traditional work patterns could pay off for women in the longer term, while <strong>Ruth Windle </strong>despairs for those who don’t have space at home. <strong>Dr Argyro Avgoustaki </strong>and<strong> Dr </strong><strong>Hans TW Frankort </strong>point to poor working conditions across the labour market"
2021-03-24,"Australia's economy is more reliant on iron ore than ever It is great for our economy, but it also means Australia’s economic base has become very narrow "
2021-03-24,"UK economy rallies as companies plan for summer of spending Surveys reveal return to growth in March, boosting hopes the Covid vaccine will bring rapid recovery"
2021-03-24,"UK inflation slows, as UK and eurozone businesses return to growth in March – as it happened Pound slips after inflation data, as oil prices soar on Suez Canal blockage"
2021-03-25,"Stock markets slide as EU leaders discuss vaccine export ban – as it happened EU leaders likely to shy away from vaccine export ban, as US growth is better than expected and AstraZeneca publishes 76% efficacy results "
2021-03-25,"UK Deliveroo riders can earn as little as £2 an hour, survey finds Analysis of 300 couriers found that as many as a third of them were paid less than legal minimum wage"
2021-03-25,UK's biggest fund manager expected to shun Deliveroo float Legal &amp; General joins growing list of investors concerned about food delivery firm’s treatment of workers
2021-03-26,"WeWork to merge with investment company two years after aborted IPO Shared-office provider plans merger with BowX Acquisition in deal that values WeWork at $9bn, down from $47bn in 2019"
2021-03-26,"Asda loses equal pay claim, as garden furniture boom boosts UK retail sales  – as it happened Court ruling has implications for workers in all major supermarkets; European stock markets push higher"
2021-03-26,Jessops calls in administrators for second time in just over year  Move by firm controlled by Dragons’ Den panellist Peter Jones puts 120 jobs at risk
2021-03-27,New Zealand's housing market is even worse than Australia. But at least their government is taking action The Ardern government is taking on speculators and investors. But there seems little chance of such changes here 
2021-03-28,"Unions urge Morrison government to lift minimum wage as jobkeeper ends  Sally McManus says rise would stimulate the economy as up to 150,000 people expected to lose their job as pandemic support measure ends<br>"
2021-03-29,Credit Suisse and Nomura warn of losses after as hedge fund fire sale – as it happened Rolling coverage of the latest economic and financial news
2021-03-29,Regulators around the world monitor collapse of US hedge fund Liquidation of Bill Hwang’s Archegos Capital Management sparked a fire sale of more than $20bn assets
2021-03-30,"Oxford Nanopore to float on London Stock Exchange Analysts estimate value of startup, whose technology tracks Covid-19 variants, could reach up to £7bn"
2021-03-30,"JD Wetherspoon to create 2,000 jobs with post-lockdown investment Pub chain’s founder says £145m project dependent on UK ‘opening back up again on long-term basis’<br>"
2021-03-30,"Green investing 'is definitely not going to work’, says ex-BlackRock executive Tariq Fancy once oversaw the start of the biggest effort to turn Wall Street ‘green’ – but now believes the climate crisis can never be solved by today’s free markets"
2021-03-30,Oxford Nanopore float offers London a proper tech future Planned IPO of life science group will test LSE’s appetite for funding high-growth tech 
2021-03-30,US and eurozone consumer confidence hit one-year highs; German inflation jumps – as it happened Rolling coverage of the latest economic and financial news
2021-03-31,"Deliveroo shares slump by 26% on London stock market debut  An estimated 70,000 retail investors see value of investments fall as takeaway firm’s IPO ‘falls flat on its face’"
2021-03-31,"Public investment in infrastructure would be a much needed boon to the Australian economy While private investment remains down, the public sector needs to fill the hole, and right now there is little sign of that occurring"
2021-03-31,Deliveroo shares plunge in disastrous market debut - as it happened Rolling coverage of the latest economic and financial news
2021-03-31,UK economy poised to recover after Covid-19 second wave Our latest snapshot of key economic indicators shows the deficit soaring but unemployment holding steady
2021-03-31,UK economy bouncing back stronger than expected amid savings boom  Expansion in second half of 2020 and increase in household savings raise hopes for recovery this year 
2021-03-31,Insurance market Lloyd's hit by loss after £6.2bn Covid payouts IIt blames natural catastrophe claims and Brexit for affecting earnings alongside the pandemic
2021-03-31,A year of Covid crisis: a glimmer of economic hope at the end of the tunnel Twelve months after the pandemic struck the Guardian’s economic tracker reveals real risk of lasting damage
2021-03-31,"Only a large-scale skills programme can protect against Covid's fallout Huge fiscal support has safeguarded jobs and demand, but only skills and training can prevent long-term economic scarring"
2021-04-01,Climate protests at Bank of England; global factory growth hits 10-year high – as it happened Rolling coverage of the latest economic and financial news
2021-04-01,Next shares hit all-time high as Covid crisis fuels online sales surge Stock surges at UK’s biggest clothing retailer after it reveals 60% rise in web sales compared with 2019
2021-04-01,"Deliveroo's IPO 'flopperoo' is enough to spoil any takeaway Most small punters knew they were taking an investment risk, so it was up to them to decide if the price was overcooked"
2021-04-01,"From dreadnoughts to schools: how much steel is from the UK?  Even when UK produces right type of steel, projects often do not use as much as they could, data shows"
2021-04-02,"US economy adds 916,000 March jobs as vaccine rollout fuels hiring boom Unemployment rate drops to 6% as businesses reopen and hire workers, with data showing that 30% of Americans have had at least one vaccine shot"
2021-04-03,"Why the wheels came off Deliveroo’s overheated stock market flotation Controversial share structures, employment conditions and ambitious valuations made the delivery company’s listing a flop. But all may not be lost…"
2021-04-04,"From bikes to booze, how Brexit barriers are hitting Anglo-Dutch trade hard A new survey of UK and Netherlands firms shows two thirds think red tape, shipping delays and higher costs have had a negative impact on them"
2021-04-05,"Goldman Sachs prepares for staff to return to London office this week Investment bank could see 200 of its 6,000 London workers back in the office after Easter break"
2021-04-06,"Pub, leisure stocks help push FTSE higher as England prepares to lift restrictions – as it happened Rolling coverage of the latest economic and financial news as businesses in England prepare to reopen on 12 April"
2021-04-06,"Western economies recovering faster than expected from Covid, says IMF Growth forecast upgraded amid US and UK vaccine programmes and stimulus packages"
2021-04-06,Credit Suisse executives depart after Archegos and Greensill losses Directors’ bonuses scrapped as chief risk officer and investment bank chief exit
2021-04-07,UK and German stocks hit record highs on Covid recovery hopes – as it happened Rolling coverage of the latest economic and financial news as Covid recovery hopes lift stocks
2021-04-07,"G20 takes step towards global minimum corporate tax rate Meetings of finance ministers follow change in US stance, with consensus growing on tackling tax avoidance"
2021-04-07,"US to enter post-Covid boom ‘torn by income inequality,’ says JP Morgan boss Jamie Dimon says in shareholder letter economy on edge of ‘Goldilocks moment’ but upbeat news comes with caveats"
2021-04-07,IMF calls for wealth tax to help cover cost of Covid pandemic Fiscal monitor says rich should pay more tax on temporary basis to help support poor and vulnerable
2021-04-09,Sheffield law firm Irwin Mitchell explores £500m stock market flotation Relatively rare move for legal firm could make paper millionaires of company’s 214 partners
2021-04-09,"Average price of UK home jumps to record high of £254,606 in March  Figures suggest government measures to support property market are continuing to drive interest"
2021-04-09,"UK house prices hit record high a year after Covid-19 lockdowns began – as it happened Rolling live coverage of business, economics and financial markets as the travel industry awaits UK holiday plans<br>"
2021-04-10,Britain is ‘bouncing back’ into the same old economy Hopes of a rapid recovery overshadow the fact that the Tories have failed to reinvent the way the UK does business
2021-04-11,London’s ‘super-prime’ luxury property market was world leader in 2020 UK capital is ‘world’s leading wealth destination’ after sales of homes worth more than £7.3m rose 3% last year
2021-04-11,"Australia’s living standards have risen and economy is ‘roaring back’, Deloitte says The jobs recovery has been ‘really remarkable’ and unemployment will continue to fall despite jobkeeper ending, report finds"
2021-04-11,"As the grip of Covid eases, the UK looks set for a classic short-lived boom Heavy borrowing by businesses could easily end in higher inflation and a ballooning trade deficit"
2021-04-12,Cybersecurity firm Darktrace plans £3bn IPO on London Stock Exchange British firm’s CEO Poppy Gustafsson says London was ‘natural choice’ despite Deliveroo’s disastrous debut
2021-04-12,"London Stock Exchange has best first quarter for IPOs since 2007 Despite the Deliveroo damp squib, the market raised more than £5bn in the first three months of 2021"
2021-04-12,"Customers flock to shops, pubs, restaurants and barbers as lockdown eases – as it happened  Rolling coverage of the latest economic and financial news, as non-essential shops reopen in England, and pubs and restaurants welcome customers outside "
2021-04-12,"Central banks becoming hooked on stimulus, Mervyn King says Former Bank of England governor warns of risk of inflation as Covid lockdown measures are relaxed"
2021-04-12,Menulog announces pivot towards ‘employment model’ for all couriers within coming years Managing director says company will trial move away from independent contractors among Sydney workers
2021-04-12,Alibaba shares jump after record $2.8bn anti-monopoly fine E-commerce firm feels penalty by Chinese regulators means focus on company is at an end
2021-04-13,UK economy returns to growth despite Covid restrictions Figures for February also show partial recovery in exports to EU after Brexit plunge
2021-04-13,Star stock picker Terry Smith paid nearly £30m as Fundsmith booms Bumper year for co-owner of UK’s largest equity fund seen as the British version of Warren Buffet
2021-04-13,"UK economy returns to growth; US inflation rises; Haldane to leave BoE – as it happened  Rolling coverage of the latest economic and financial news, as the UK economy returns to growth and one of its top central bankers steps down "
2021-04-14,"Stocks lacklustre; easyJet CEO sees most European countries on UK’s green list – as it happened EasyJet to ramp up flying in late May, as International Energy Agency lifts oil demand forecast amid rising hopes for global economy"
2021-04-14,Aerospace body urges government to secure Liberty Steel supply ADS Group wants continuity of production as Sanjeev Gupta seeks finance after collapse of Greensill<br>
2021-04-14,Foxtons faces backlash by shareholders over CEO’s near-£1m bonus London estate agent criticised after taking almost £7m of government Covid support
2021-04-14,Jobkeeper doubled return for investors compared with companies that did not have subsidy Exclusive: Labor says analysis shows millions of dollars in jobkeeper money has been used to pay dividends to billionaires
2021-04-15,"US stock markets hit record highs as economy appears to rebound strongly Sharp rise in consumer spending, falling unemployment claims and strong earnings from some of the largest companies boost markets"
2021-04-15,The Hut Group CEO donates £100m to charitable foundation Matthew Moulding became a billionaire after the company’s successful stock market flotation
2021-04-15,"Pimm’s may bubble post-lockdown, but the future for many is less cheery A quarter of companies caught in the recent lockdown have little or no confidence of recovery"
2021-04-15,Markets hit fresh highs as US retail sales and jobless claims boost recovery hopes – as it happened Rolling coverage of the latest economic and financial news
2021-04-15,Hedge fund profits boom despite some high-profile problems Funds made gains of 6% for the first quarter of the year – the strongest since the 2008 financial crisis
2021-04-15,Almost 40% of UK workers ‘get less than a week’s notice of shift patterns’ New research suggests chaotic employment practices are spreading into professional roles
2021-04-16,MusicMagpie plans £208m flotation on London stock market Online reseller that specialises in secondhand tech will list on Aim
2021-04-16,"FTSE 100 index closes over 7,000 points; Archegos collapse costs Morgan Stanley $911m – as it happened Rolling coverage of the latest economic and financial news"
2021-04-16,"FTSE 100 closes above 7,000 for first time since Covid crash Shares rise by more than 30 points as China reports record economic growth"
2021-04-17,Chinese firms prepare to charge into Europe’s electric car market Tesla could be in for a shock as far-eastern rivals use cheap money to gain traction among affluent western car buyers
2021-04-17,Labour ramps up pressure on Sunak over Greensill calls with Cameron Content of at least one phone call about collapsed finance firm with ex-PM is yet to be released
2021-04-18,UK house prices surge as high demand meets record shortage of homes for sale Government to unveil new 95% mortgage guarantee scheme as Rightmove says average asking price rose 2.1% in April
2021-04-19,UK probes Nvidia’s Arm deal; workers split over return to office – as it happened Rolling coverage of the latest economic and financial news
2021-04-19,"UK taxpayers face £120m compensation bill for LC&F scandal Government announces payouts for almost 9,000 people who invested in defunct London Capital &amp; Finance<br>"
2021-04-19,Australia has coped fairly well with the pandemic. With climate change? It’s a different story Our economy remains one of the most highly dependent upon greenhouse gases
2021-04-19,European Super League clubs promised €200m-€300m ‘welcome bonus’ JP Morgan commits €3.25bn to getting breakaway competition off the ground
2021-04-20,Social media sites warned over risky investment offers City watchdog flags up platforms such as YouTube and TikTok in promoting investments to inexperienced consumers
2021-04-20,"FTSE 100 posts biggest fall in two months as Covid-19 worries hit markets – as it happened  Tobacco, travel and hospitality stocks lead fallers on the FTSE 100 index, as European markets have worst day this year "
2021-04-21,"Leading finance firms sign up to Mark Carney forum on low-carbon investment Barclays, HSBC and Axa among 160 firms in global alliance to hasten transition to net zero economies"
2021-04-21,"Ireland will resist global corporate tax rate, says finance minister Paschal Donohoe says Dublin will not accept reforms that affect its ability to undercut its rivals"
2021-04-21,"Ikea to invest £3.4bn in renewable energy by 2030  Swedish retailer is set to build wind and solar farms, and make first steps into energy storage "
2021-04-21,"UK house prices rise at fastest pace since 2014; fuel and clothes lift inflation – business live Rolling coverage of the latest economic and financial news, as rising fuel and clothing costs push up the consumer prices index"
2021-04-21,UK inflation driven up by rising cost of petrol and clothes Consumer prices index rose to 0.7% in March as economy recovers from Covid-19 crisis
2021-04-22,UK manufacturing optimism highest since 1973; ECB presses on with bond purchases – as it happened Rolling coverage of the latest economic and financial news
2021-04-22,Dentists get creative in bid to recover from Covid downturn 2020 was a challenging year for the dental industry. But hardships often bring out the best in small business owners
2021-04-22,UK manufacturers record sharpest rise in optimism since 1973 as Covid recedes CBI poll of 288 leading companies finds firms plan to hire at fastest rate in nearly 50 years 
2021-04-23,"UK retail sales jump 5.4% as businesses grow at fastest rate since 2013 – as it happened Sales of clothing, fuel, mobility equipment for older people and at garden centres were strong, as UK borrowing rounds out worst year for public finances since 1947"
2021-04-23,Jeff Fairburn could cash in again after Avant Homes takeover Acquisition puts ex-Persimmon boss in position to exploit UK housing market – and taxpayers’ money<br>
2021-04-25,"UK replaces France as Europe’s second largest electric car market About 31,800 battery electric cars were sold in Britain in first three months of 2021"
2021-04-25,UK economy predicted to grow at fastest rate since second world war EY Item Club upgrades forecasts for 2021 after businesses adapted better to Covid controls
2021-04-25,"Gousto to take on 1,000 staff as sales more than double in Covid crisis Meal kit company reports first profit after ‘capitalising on the biggest trends in grocery’"
2021-04-25,A glance across the Atlantic would show Sunak what real tax reform looks like Joe Biden is about to shake up US taxation policy. The UK must hope that the chancellor feels a need to emulate him
2021-04-26,"Greensill made scramble for cash months before collapse, US court filings claim Moves came as lender was trying to convince investors it was worthy of multibillion-dollar stock market debut, documents allege"
2021-04-26,Emergent chief sold $10m in stock before company ruined 15m Covid vaccines Stock unloaded by Robert G Kramer would now be worth only $5.5m while FDA report found unsanitary conditions at plant
2021-04-26,"BA boss says rich holidaymakers will make up for fall in business-class flying Sean Doyle confident the airlines investment in refurbishing premium cabins, seat and lounges will pay off"
2021-04-26,UK ‘rebounding sharply’; supply bottlenecks hit German firms; travel shares rally – as it happened Rolling coverage of the latest economic and financial news
2021-04-27,Archegos losses hit $10bn; US house prices and consumer confidence surge; HSBC and BP beat forecasts – as it happened Rolling coverage of the latest economic and financial news
2021-04-27,Calls for ministers to ‘come clean’ over links to cross-Channel power cable sponsor  Labour says business ministers should recuse themselves over ‘conflict of interest’
2021-04-28,"Stock markets rise ahead of Fed decision, as banks report bumper profits – as it happened Markets rise on recovery hopes, as Federal Reserve is set to maintain near-zero interest rates and bond-buying programme"
2021-04-29,Unilever sales buoyant as consumers stock up on food in lockdown China’s recovery from pandemic helps figures although spending on beauty and personal care ‘subdued’<br>
2021-04-29,Gordon Brown leads calls for $60bn of Covid support for poor countries  Former PM urges G7 leaders to help finance rapid immunisation programme to stem spread of virus 
2021-04-29,"Biden’s plans are ‘once in a lifetime’ chance to end global tax abuse, says OECD boss Ángel Gurría says international deal is within striking distance and could be signed this summer"
2021-04-29,An overhaul of the global tax system can wait no longer The Covid-ravaged global economy is at a crossroads: we can commit to greater tax cooperation or risk a tax-driven trade war
2021-04-29,"Biden attempts to consign trickle-down economics to the dustbin of history Analysis: why the president wants to build the US economy from the middle and bottom, not top down"
